{
  "$schema": "https://schema.evideris.com/derived/schemas/evidence-criterion.schema.json",
  "$id": "https://schema.evideris.com/derived/evidence-criterion/emr-cln/anticoagulant-protocols-evidence.v1.0.0.json",
  "lineageId": "ec-emr-unit-anticoagulant-protocols",
  "type": "evidenceCriterion",
  "version": "1.0.0",
  "release": "r2026.07",
  "supersedes": null,
  "supersededBy": null,
  "language": [
    "en"
  ],
  "forStandard": "std-emr-unit-anticoagulant-protocols",
  "criteria": [
    {
      "description": {
        "en": "Copy of local anticoagulant management pathway, with explicit reference to the current ESGE/BSG anticoagulant-in-endoscopy guideline."
      },
      "evidenceType": "document-upload",
      "auditFrequency": "annual"
    },
    {
      "description": {
        "en": "Annual audit of compliance with pathway across all EMR cases in the prior 12 months."
      },
      "evidenceType": "audit-sample",
      "auditFrequency": "annual"
    }
  ],
  "_meta": {
    "provenance": {
      "type": "evideris-design",
      "reason": "Concrete evidence specs Evideris designed for the M3 Centre Accreditation evidence-pack generator. NOT published by ESGE \u2014 the source standard (text) is verbatim from Tate EMR 2023 Rec 2 sub-item, but the evidence-required list is Evideris's operationalisation of what compliance proof looks like.",
      "derived_from": [
        "std-emr-unit-anticoagulant-protocols"
      ]
    },
    "encodedBy": "human:david",
    "encodedAt": "2026-06-28"
  }
}
